id,id_media_type,published_date,title,url,link_download,link_full_version,author,isbn,price,rate,jenis_rate,origin,size,page,tags,summary,status,image,image_preview_1,image_preview_2,image_preview_3,image_preview_4,image_preview_5
3010,1,2/3/2016,Angel Trumpet 02,http://www.gramedia.com,,,MICHIYO AKAISHI,978-602-339-797-6,20000,4,R,Jepang,"11,4 x 17,2",192,"drama,fantasy,thriller,mystery","Marimo dan Rin, dua bersaudara yang sedang melarikan diri dari organisasi misterius yang berniat membunuh mereka. Rin mampu melukai dan membunuh orang hanya dengan sentuhan, sementara Marimo tampaknya adalah satusatunya orang yang mampu mengendalikan kekuatan Rin. Kekuatan misterius itu muncul sejak terjadinya gempa dan insiden ledakan yang terjadi di suatu hari itu…
Siapakah identitas sesungguhnya dari musuh yang mengejar kedua anak kecil itu? Lalu janji penting apa yang mereka buat dengan ibu mereka?",,3010_Angel_Trumpet_02.jpg,,,,,
3011,1,1/3/2016,In The Name of Love 03,http://www.gramedia.com,,,MOMO UMETANI / MIZUKI TSUGE,978-602-339-806-5,20000,5,R,Jepang,"11,4 x 16,8",168,"drama,romance,shoujo,fantasy","Chizuko harus berpisah dengan Daitounomiyasama. Tak disangka, Yamato malah bertemu dengan sang putra kaisar di tengah perjalanan!

Ringkasan cerita:
Chizuko mengalami time slip ke zaman Kamakura kuno dan terpisah dari keluarganya. Dia disambut oleh keluarga yang baik hati, dan seorang pendeta Buddha misterius yang menarik tangannya untuk mengalami time slip. 
",,3011_In_The_Name_of_Love_03.jpg,,,,,
3012,1,2/3/2016,Happy Cooking Graffiti 01,http://www.gramedia.com,,,MAKOTO KAWAI,978-602-339-757-0,20000,4,R,Jepang,"11,4 x 17,2",120,"drama,aadventure,slice of life,cooking,food","Machiko Ryou adalah anak SMP yang hidup sendirian sejak neneknya meninggal. Walaupun jago masak, Ryou merasa masakannya tidak enak, sampai kemudian Ryou bertemu sepupu jauhnya, Morino Kirin. Karena ikut les di Tokyo, Kirin tinggal bersama Ryou setiap akhir minggu. Kirin menunjukkan pada Ryou bagaimana agar makanan terasa enak, yaitu dengan cara memakannya bersama temanteman dan keluarga.
",,3012_Happy_Cooking_Graffiti_01.jpg,,,,,
3013,1,2/3/2016,Sweet Berry 05 #tamat,http://www.gramedia.com,,,AKI ARATA,978-602-339-810-2,20000,4,R,Jepang,"11,4 x 16,8",184,"drama,romance,shoujo,school life,comedy","Mizuhara Hiyori kewalahan karena mengalami banyak masalah karena fetish yang dideritanya, dia berusaha menyembunyikannya setelah masuk SMA. Tapi ternyata dia menemukan objek fetish baru, Narita, yang segera tahu kelainannya itu. Sedangkan Takaomi, teman masa kecil Mizuhara, menyatakan perasaannya pada Mizuhara. Akan dibawa ke mana perjalanan cinta Mizuhara? Inilah jilid terakhir kisah love comedy.
",,3013_Sweet_Berry_05_#tamat.jpg,,,,,
3014,1,2/3/2016,Laughing Under The Clouds 06 #tamat,http://www.gramedia.com,,,KARAKARA KEMURI,978-602-339-788-4,20000,5,R,Jepang,"11,4 x 16,8",192,"drama,shounen,fantasy,action","Para tahanan Gokumonjo yang dipimpin oleh Shirasu dan saudara kembarnya mulai bergerak dan menimbulkan kekacauan. Tubuh Soramaru pun telah dikuasai oleh Orochi!  Tenka, Chutaro dan pasukan Yamainu berusaha untuk melepaskan Soramaru dari Orochi. Pertempuran besar pun tak terelakkan lagi! Mampukah mereka menaklukkan Orochi? Dan apakah Donten bersaudara akan bisa berkumpul dan tertawa lagi? Ikuti kisah mereka di volume terakhir ini!
 ",,3014_Laughing_Under_The_Clouds_06_#tamat.jpg,,,,,
3015,1,2/3/2016,The Swordsman 07,http://www.gramedia.com,,,LEE JAE HEON / HONG KI WOO,978-602-339-772-3,25000,4,R,Korea,13 x 18,168,"drama,action,adventure,history","Deungpae, perisai yang terbuat dari bambu dan tanaman wisteria yang biasa digunakan di militer pada jaman Joseon. 
Cara membuatnya, setelah rotan dikeringkan dan direndam dalam minyak, rotan harus dikeringkan kembali. Dan proses itu harus diulang hingga dua puluh kali…
Setelah itu pun rotan itu harus dianyam dengan rapi menjadi bentuk perisai…
Menurut sejarah, peluru pun tidak mampu menembusnya!
",,3015_The_Swordsman_07.jpg,,,,,
3016,1,2/3/2016,Death Note 01 (terbit ulang),http://www.gramedia.com,,,TSUGUMI OHBA / TAKESHI OBATA,978-602-339-777-8,20000,5,R,Jepang,"11,2 x 17,6",200,"drama,mystery,psychological","""Orang yang namanya ditulis di buku ini akan mati..."" 
DEATH NOTE adalah sebuah buku catatan yang dijatuhkan oleh Shinigami Ryuk ke dunia manusia. Inilah awal dimulainya pertarungan hidupmati antara Light Yagami dan L.
",,3016_Death_Note_01_(terbit_ulang).jpg,,,,,
3017,1,2/3/2016,Death Note 02 (terbit ulang),http://www.gramedia.com,,,TSUGUMI OHBA / TAKESHI OBATA,978-602-339-778-5,20000,5,R,Jepang,"11,2 x 17,6",200,"drama,psychological,mystery","Setelah berhasil mengetahui nama agen FBI yang membuntuti dirinya, 
Light menghakimi FBI dengan keyakinan bahwa ""tindakannya benar"". 
Sementara itu, L yang sedang mengejar Light akhirnya menampakkan dirinya... 
",,3017_Death_Note_02_(terbit_ulang).jpg,,,,,
3018,1,2/3/2016,Death Note 03 (terbit ulang),http://www.gramedia.com,,,TSUGUMI OHBA / TAKESHI OBATA,978-602-339-779-2,20000,5,R,Jepang,"11,2 x 17,6",200,"drama,mystery,psychological","Mengawasi dan diawasi...!

Pertarungan antara L dan Light Yagami berkembang lewat kamera tersembunyi. Walaupun Light berhasil membuktikan dirinya tak bersalah, namun kecurigaan L kepada Light justru semakin meningkat! 
",,3018_Death_Note_03_(terbit_ulang).jpg,,,,,
3019,1,2/3/2016,Death Note 04 (terbit ulang),http://www.gramedia.com,,,TSUGUMI OHBA / TAKESHI OBATA,978-602-339-780-8,20000,5,R,Jepang,"11,2 x 17,6",208,"drama,mystery,psychological","Atas petunjuk L, polisi memutuskan untuk memanggil Light setelah muncul KIRA kedua. Saat itulah, Light menyadari tujuan utama yang tersembunyi dari pesanpesan yang dikirimkan oleh KIRA palsu.
",,3019_Death_Note_04_(terbit_ulang).jpg,,,,,
3020,1,9/3/2016,Chocolate Magic Love Flake,http://www.gramedia.com,,,RINO MIZUHO,978-602-339-831-7,20000,5,R,Jepang,"11,2 x 17,6",192,"drama,shoujo,mystery","Selamat datang di Chocolat Noir. Aku menjual cokelat yang bisa memenuhi keinginan apapun. Saat karirmu dihalangi orang lain, maukah kau merebutnya kembali dengan cokelatku?
",,3020_Chocolate_Magic_Love_Flake.jpg,,,,,
3021,1,9/3/2016,The Black Devil and The White Prince 02,http://www.gramedia.com,,,MAKINO,978-602-339-811-9,20000,4,R,Jepang,"11,4 x 17,2",176,"drama,romance,shoujo,school life","Karena kelasnya menang di pertandingan olahraga, Yuu harus menepati janjinya untuk menuruti semua perintah Kurosaki. Sementara itu, Yuu juga semakin dekat dengan Shirakawa, “Pangeran Putih” yang diidolakan semua orang. Ketika Shirakawa mengajak Yuu pergi ke taman hiburan, tak disangka mereka bertemu dengan Kurosaki! Kurosaki yang cemburu menarik Yuu untuk menjauh dari Shirakawa. Apa yang akan dilakukan Kurosaki pada Yuu!?
",,3021_The_Black_Devil_and_The_White_Prince_02.jpg,,,,,
3022,1,9/3/2016,Kasane 02,http://www.gramedia.com,,,DARUMA MATSUURA,978-602-339-803-4,30000,5,D,Jepang,"11,4 x 17,2",192,"drama,mystery,fantasy","Seorang gadis buruk rupa, Kasane, mendapatkan sebuah lipstik peninggalan ibunya.Lipstik itu memiliki kemampuan tersembunyi yang memungkinkan pemakainya ""mengambil"" wajah orang lain!Kasane pun bertekad menggunakan kekuatan ini demi merebut semua hal yang hanya bisa dimiliki oleh orang-orang rupawan.Kini di hadapan Kasane muncul Nina Tanzawa, seorang  gadis dengan kecantikan luar biasa.
",,3022_Kasane_02.jpg,,,,,
3023,1,9/3/2016,Life at The Monster Apartment 03,http://www.gramedia.com,,,KOUZUKI HINOWA/ WAKA MIYAMA,978-602-339-821-8,20000,4,R,Jepang,"11,4 x 17,2",192,"drama,mystery,shoujo,school life","Yuushi jadi majikan buku sihir yang dibawa Furuhonya, dan dimulailah masa latihan Yuushi dengan bimbingan Akine! Hase pun akhirnya tahu rumitnya kehidupan Yuushi dan memutuskan untuk mampir ke Apartemen Monster! Bagaimana reaksi Hase setelah itu?
",,3023_Life_at_The_Monster_Apartment_03.jpg,,,,,
3024,1,9/3/2016,Bento With Love,http://www.gramedia.com,,,VEGA NAKASHIMA,978-602-339-825-6,20000,4,R,Jepang,"11,4 x 17,2",192,"drama,school life,shoujo,romance","Komik ini terdiri dari 5 cerita pendek. Cerita utamanya tentang Rin, satu-satunya gadis miskin yang bersekolah di sekolah anak orang kaya. Suatu hari, di tempat Rin bekerja paruh waktu, tanpa sengaja ia bertemu Yazaki, cowok populer di sekolahnya. Itu sangat gawat sebab peraturan sekolah melarang murid bekerja paruh waktu. Rin kemudian memohon pada Yazaki agar merahasiakan hal tersebut. Yazaki setuju, tapi dia mengajukan syarat yang mengejutkan, yaitu Rin tiap kali harus membawakannya bekal makan siang dan menemaninya makan siang. 
Rin yang miskin sering terlihat makan siang bersama Yazaki yang ganteng, tentu saja membuat Rin lagi-lagi jadi bahan gunjingan di sekolahnya. Kimi, salah satu teman sekelas yang sirik pun memata-matai Rin dan berhasil memotret Rin diam-diam saat sedang bekerja paruh waktu. Akankah orang yang mengancam Rin akan bertambah seorang lagi? 

",,3024_Bento_With_Love.jpg,,,,,
3025,1,9/3/2016,Samurai Drive 06,http://www.gramedia.com,,,FUJIKO KOSUMI,978-602-339-735-8,20000,5,R,Jepang,"11,4 X 16,8",176,"drama,school life,action,shoujo,bishie","Setelah peristiwa ditembaknya Jin Saito oleh Kelompok Taitou Baru, Shiseikan yang tadinya bersatu sekarang pecah menjadi dua kelompok.
Ada “kelompok yang ingin segera bertindak” dan “kelompok yang tidak ingin gegabah”! 
Bagai menari di atas kesusahan orang lain, rencana Kelompok Taitou Baru pun berjalan lancar!?",,3025_Samurai_Drive_06.jpg,,,,,
3026,1,9/3/2016,Black Bullet 02 0f 4,http://www.gramedia.com,,,SHIDEN KANZAKI / MORINOHON,978-602-339-829-4,20000,5,R,Jepang,"11,4 x 16,8",168,"drama,action,fantasy","Kisah ini terjadi di masa depan yang tidak begitu jauh…
Manusia kalah dalam pertempuran melawan virus misterius yang disebut, “Gastrea”. Umat manusia hidup dalam keputusasaan sambil diselubungi rasa takut oleh sosok Gastrea.
Pada suatu hari, Rentaro Satomi mendapat misi untuk mencegah bahaya yang mengintai area Tokyo. Apa yang akan dilakukan Rentaro saat ia mengetahui bahwa orang-orang yang hendak ia lindungi ternyata melakukan kejahatan yang keji? Ditambah lagi, Rentaro harus berhadapan dengan musuh kejam yang menginginkan musnahnya umat manusia, Kagetane Hiruko!",,3026_Black_Bullet_02_0f_4.jpg,,,,,
3027,1,9/3/2016,A Lower Grade Boy 2 #tamat,http://www.gramedia.com,,,MAMORU AOI,978-602-339-812-6,20000,5,R,Jepang,"11,2 x 17,6",168,"drama,romance,shoujo,school life","Dengan suka cita, Hasshi, pacar Kurumi yang lebih muda setahun, masuk ke SMA yang sama. Tapi, teman sekelas Hasshi dan Kak Yanai jadi terlibat, dan membuat ketidakcocokan di antara mereka berdua. Bagaimanapun juga, perbedaan usia membuat Kurumi khawatir... 
Akankah cinta keduanya bertahan?",,3027_A_Lower_Grade_Boy_2_#tamat.jpg,,,,,
3028,1,9/3/2016,Replica 04 #tamat,http://www.gramedia.com,,,KARAKARA KEMURI,978-602-339-808-9,20000,5,R,Jepang,"11,4 x 16,8",184,"drama,fantasy,action","Dongeng itu telah berakhir.
Kini, pertanyaan yang tersisa adalah…
sanggupkah anggota CARDS yang tersisa melangkah maju?
Apakah mereka akan kembali ke kehidupan masing-masing?
Atau… berusaha menghidupkan kembali yang sudah hancur?",,3028_Replica_04_#tamat.jpg,,,,,
3029,1,9/3/2016,The Tiger Wong Chronicle : Dong Fang Zhen Long 01,http://www.gramedia.com,,,TONY WONG,978-602-339-800-3,100000,5,R,Hongkong,17 x 24.5,200,"drama,action,battle","Pertarungan para Jagoan Timur melawan sang ketua Aliran Teratai Putih, Dongfang Zhenlong kian sengit. Jurus-jurus mematikan saling baku hantam untuk menjatuhkan pihak lawan. Serangan demi serangan yang menghujam Dongfang Zhenlong semakin gencar. Demi gengsi di jagad Dunia Persilatan serta keinginan untuk meraih gelar Si Tanpa Tanding di Kolong Langit, Dongfang Zhenlong mengeluarkan Jurus Pamungkas dari ilmu 10 Matahari. Mampukah Tiger CS bertahan di dalam medan energi 10 Matahari yang panas teriknya menyengat tubuh dan jiwa!?  
",,3029_The_Tiger_Wong_Chronicle_:_Dong_Fang_Zhen_Long_01.jpg,,,,,
3030,1,16/03/2016,Idol x Actor x Megane Boy 04,http://www.gramedia.com,,,YUKI SHIRAISHI,978-602-339-834-8,20000,5,R,Jepang,"11,2 x 17,6",184,"drama,romance,shoujo,school life,childhood","Rei yang dikagumi Shizuku menyatakan perang kepada Yori!! 
Aktor yang sangat populer itu mengatakan, “Shizuku lebih cocok di sampingku.” Lalu, bagaimana reaksi Yori terhadap Rei yang memiliki kemampuan dan kepopuleran yang melimpah sebagai aktor itu? 
Lalu... Shizuku akan menikah? ? Tapi siapakah pasangannya?
",,3030_Idol_x_Actor_x_Megane_Boy_04.jpg,,,,,
3031,1,16/03/2016,Hey I'm Popular 04,http://www.gramedia.com,,,JUNKO,978-602-339-820-1,20000,4,R,Jepang,"11,2 x 17,6",168,"drama,romance,school life","1. Kae kembali menjadi gemuk, tapi kemudian berhasil jadi cantik lagi. 
2. Igarashi yang kembali jatuh cinta pada Kae, mulai mendekatinya secara serius!!
3. Lalu, Nanashima yang tak mau kalah dari Igarashi pun mulai bergerak!!
4. Kalian juga bisa membaca bonus cerita tentang White Day dan melihat desain karakter komik Hey, I’m Popular yang diungkap habishabisan. Bagaimana ini?!!
",,3031_Hey_I'm_Popular_04.jpg,,,,,
3032,1,16/03/2016,Stardust Wink 02,http://www.gramedia.com,,,NANA HARUTA,978-602-339-822-5,20000,5,R,Jepang,"11,2 x 17,6",176,"drama,romance,shoujo,school life","Halo, aku Mashiro! 
Aku jadi guru privat Anna 
yang akan mengikuti ujian masuk SMA.
Katanya, aku ini cinta pertama Anna. 
Tapi aku tahu siapa sebenarnya yang disukai Anna 
baik dulu maupun sekarang... ?
",,3032_Stardust_Wink_02.jpg,,,,,
3033,1,16/03/2016,Extra Girl 03,http://www.gramedia.com,,,MICHIYO AKAISHI,978-602-339-814-0,20000,5,R,Jepang,"11,2 x 17,6",192,"drama,mystery,investigation","“Ayo, berjuang dengan mempertaruhkan nyawa. Kalau kamu serius, aku juga akan serius mengorbitkanmu. Akan kulindungi kamu sekuat tenaga!”, ucap Fuji.
Kuon berjuang mengejar pembunuh adik kembarnya, Shion. Untuk melindungi Kuon, Okusu sang manajer memberi nama baru untuknya, “KU” dan mendorongnya membuat debut besar di dunia hiburan! Dan terjadilah perubahan besar dalam hubungan Kuon dan Fuji, mantan pacar Shion!

",,3033_Extra_Girl_03.jpg,,,,,
3034,1,16/03/2016,No. 6 vol. 7,http://www.gramedia.com,,,ATSUKO ASANO / HINOKI KINO,978-602-339-818-8,20000,5,R,Jepang,"11,2 x 17,6",168,"drama,action,adventure","“Sion, apa yang ada dalam pikiranmu?”
Sion dan Nezumi berhasil masuk ke dalam Lembaga Pemasyarakatan dengan memanfaatkan keributan yang dipicu Inukashi. Dalam perjalanan menuju lantai teratas untuk menyelamatkan Safu, mereka berdua menemukan barisan jasad manusia yang telah dikeluarkan otaknya. 
Sungguh pemandangan yang mengerikan! 
Tidak lama kemudian, Nezumi yang terpojok sudah bersiap untuk mati, akan tetapi Sion malah mengacungkan pistol kepada musuh! Mampukah Sion dan Nezumi selamat dari pertarungan hidup dan mati ini?!
",,3034_No._6_vol._7.jpg,,,,,
3035,1,16/03/2016,Sayonara Piano Sonata 02 of 3,http://www.gramedia.com,,,HIKARU SUGII / AKA AKASAKA,978-602-339-761-7,20000,4,R,Jepang,"11,4 x 16,8",200,"drama,school life,shoujo","Nao bertemu dengan gadis misterius itu secara kebetulan. Dia terpesona oleh permainan pianonya. Barulah dia tersadar bahwa gadis itu adalah Ebisawa Mifuyu, pianis muda jenius yang kabarnya sudah mundur dari dunia musik!
Ringkasan cerita:
Nao adalah seorang pemuda yang suka utak atik barang, anak seorang kritikus musik yang tak bertanggung jawab. Karena biasa dengar musik, Nao punya selera bagus. Saat mencari onderdil untuk alat yang rusak, Nao bertemu dengan Ebisawa Mifuyu, seorang pianis muda jenius yang sudah mundur dari dunia musik. Ternyata Ebisawa pindah ke sekolahnya, dan di sana dia tak lagi main piano, melainkan main gitar.",,3035_Sayonara_Piano_Sonata_02_of_3.jpg,,,,,
3036,1,16/03/2016,The Binding Princess 02 of 3,http://www.gramedia.com,,,HARU HIMENO / YUMA MIZUKI,978-602-339-782-2,20000,4,R,Jepang,"11,4 x 16,8",208,"drama,shoujo,mystery","Kukuri dan Tsumugi berusaha menghilangkan kutukan yang membuat Mikado kehilangan kesadarannya. Tapi Kukuri sadar bahwa sekalipun dia berhasil menyelamatkan Mikado, dia tidak bisa terus berlari dan menghindari kakaknya. Kukuri pun berniat untuk kembali ke desa Himekami dan menghadapi takdirnya. Apakah yang akan ditemuinya di sana? ",,3036_The_Binding_Princess_02_of_3.jpg,,,,,
3037,1,16/03/2016,Dr Shiina’s Wildlife Encyclopedia 05,http://www.gramedia.com,,,SHIYA TOTSUKI,978-602-339-823-2,20000,4,R,Jepang,"11,4 x 16,8",168,"drama,adventure,shoujo","Pejabat tingkat atas Universitas Yamasuso terguncang dengan terungkapnya hubungan antara komisaris universitas dengan Asosiasi Binatang Gordon yang terkenal dengan aktivitas perlindungan alamnya yang ekstrem. Sementara itu, asisten riset yang tenang, Ryo Shiina, associate Profesor yang jenius, Hana, dan rekanrekannya di laboratorium… apakah mereka akan terus menimbulkan masalah sulit yang tak selaras dengan harihari hewan yang damai…? 

Inilah kisah tentang ilmuwan pemula dan pengamatan ekologi seharihari hewan!",,3037_Dr_Shiina’s_Wildlife_Encyclopedia_05.jpg,,,,,
3038,1,16/03/2016,The General's Daughter 11,http://www.gramedia.com,,,HAN YU RANG,978-602-339-824-9,30000,5,R,Korea,"13,2 x 20",160,"drama,slice of life,romance","Peristiwa yang menimpa kakaknya membuat Do Dan Ji semakin marah pada Ship Do Kki. Meski orangtuanya rela berdamai dengan ayah Ship Do Kki, tapi Do Dan Ji tidak mau membiarkan Ship Do Kki begitu saja. Kini Ship Do Kki dan Kim Hee Woon telah mengetahui identitas dirinya dan saudara kembarnya. Lalu bagaimana nasib mereka di sekolah?
",,3038_The_General's_Daughter_11.jpg,,,,,
3039,1,16/03/2016,Death Note 05 (terbit ulang),http://www.gramedia.com,,,TSUGUMI OHBA / TAKESHI OBATA,978-602-339-789-1,20000,5,R,Jepang,"11,2 x 17,6",200,"drama,mystery,psychological","Untuk mengamankan Misa, Light yang terdesak meminta agar dirinya disekap. Setelah itu, ia memberitahu Ryuk untuk membuang DEATH NOTE miliknya! Apa yang sedang direncanakannya? Sementara itu, diamdiam KIRA beraksi kembali!",,3039_Death_Note_05_(terbit_ulang).jpg,,,,,
3040,1,16/03/2016,Death Note 06 (terbit ulang),http://www.gramedia.com,,,TSUGUMI OHBA / TAKESHI OBATA,978-602-339-790-7,20000,5,R,Jepang,"11,2 x 17,6",200,"drama,mystery,psychological","Setelah Yagami dan Amane, kini muncul KIRA yang lain. 
Namun, KIRA yang satu ini melakukan pembunuhan demi kepentingan pribadi dan berlindung di balik 8 orang kuat Yotsuba. 
Ryuzaki dan Light bekerja sama untuk menangkapnya, namun Matsudalah yang akan menentukan berhasil tidaknya rencana perburuan terhadap KIRA! ",,3040_Death_Note_06_(terbit_ulang).jpg,,,,,
3041,1,16/03/2016,Death Note 07 (terbit ulang),http://www.gramedia.com,,,TSUGUMI OHBA / TAKESHI OBATA,978-602-339-791-4,20000,5,R,Jepang,"11,2 x 17,6",200,"drama,mystery,psychological","Para penyelidik dan polisi sudah mengepung Higuchi yang memiliki Death Note. Apakah Light akan mendapatkan kembali Death Note miliknya? Lalu, apakah rencana yang sudah dirancang Light sebelum disekap menjadi kenyataan?  Fakta mengejutkan telah menunggu..!
",,3041_Death_Note_07_(terbit_ulang).jpg,,,,,
3042,1,16/03/2016,Death Note 08 (terbit ulang),http://www.gramedia.com,,,TSUGUMI OHBA / TAKESHI OBATA,978-602-339-792-1,20000,5,R,Jepang,"11,2 x 17,6",208,"drama,mystery,psychological","Bersamaan dengan kematian L, dunia ideal yang dicitacitakan oleh Light Yagami mulai mendekati kenyataan. Tapi, dua penerus L yaitu Near dan Mello mulai beraksi. Pertarungan perebutan DEATH NOTE  kembali dimulai! Mello kemudian menculik Sayu Yagami dan meminta pertukaran dengan DEATH NOTE...!",,3042_Death_Note_08_(terbit_ulang).jpg,,,,,
3043,1,23/03/2016,Shanaou Yoshitsune Genpei War 28,http://www.gramedia.com,,,HIROFUMI SAWADA,978-602-339-804-1,25000,5,R,Jepang,"11,2 x 17,6",248,"drama,action,battle","Hyota, seorang pengamen jalanan, berhasil menggulingkan Heike sebagai Yoshitsune menggantikan Ushiwaka. Namun, setelah identitasnya terkuak, Yoritomo malah memutuskan untuk membunuh Yoshitsune. 
Sementara itu, Minamoto no Yukiie datang menemui Yoshitsune untuk mengajaknya melakukan pemberontakan terhadap Kamakura!
",,3043_Shanaou_Yoshitsune_Genpei_War_28.jpg,,,,,
3044,1,23/03/2016,Psycho Pass! Inspector Shinya Kogami 01,http://www.gramedia.com,,,NATSUO SAI / MIDORI GOTO,978-602-339-827-0,20000,5,R,Jepang,"11,4 x 16,8",160,"drama,action,fantasy,battle","Di masa depan, keadaan mental, kepribadian, dan probabilitas bahwa seseorang akan melakukan kejahatan dapat diukur. Nilai-nilai yang menentukan standar pikiran manusia, dan bahkan jiwa individu itu sendiri disebut “Psycho-Pass”. Shinya Kogami dan timnya bertugas menangkap orang-orang yang nilainya berada di bawah standar Psycho-Pass, yaitu mereka yang dianggap berbahaya bagi masyarakat dan kemungkinan akan melakukan kejahatan. 

",,3044_Psycho_Pass!_Inspector_Shinya_Kogami_01.jpg,,,,,
3045,1,23/03/2016,Border 03,http://www.gramedia.com,,,YUA KOTEGAWA / KAZUKI KANESHIRO,978-602-339-826-3,20000,5,R,Jepang,"11,2 x 17,6",184,"drama,psychological,mystery,supernatural","Kemampuannya “berbicara dengan orang mati” sangat membantu Detektif Ango Ishikawa melakukan penyelidikan, mengungkap kebenaran, menangkap si penjahat.
Namun kali ini Sang Detektif berada di persimpangan! Kemampuannya itu justru membuatnya terjebak antara hitam dan putih, hukum dan keadilan, kebaikan dan kejahatan.
Siapa sangka, roh orang mati yang berusaha dia tolong ternyata berbohong, menyebabkan tragedi mematikan!
 ",,3045_Border_03.jpg,,,,,
3046,1,23/03/2016,Preparation for Love 02 of 4,http://www.gramedia.com,,,TAKAKO YAMAZAKI,978-602-339-815-7,20000,5,R,Jepang,"11,2 x 17,6",192,"drama,romance,shoujo,school life","Nissei Yamato, terus menjalani hari-hari yang tidak bersemangat dalam kegiatan klub, pekerjaan, cinta, dan pendidikan.  Suatu hari, di depan Nissei muncul ""orang yang melakukan apa saja"". Ia meminta bantuan Nissei untuk mencari seseorang.
Tidak disangka, ternyata ""orang yang melakukan apa saja"" itu memiliki hubungan dengan orang yang dikenal baik oleh Nissei. Siapakah orang itu? Dan bagaimana kemajuan hubungan Nissei dan Yuzutsu yang semakin dekat?
",,3046_Preparation_for_Love_02_of_4.jpg,,,,,
3047,1,23/03/2016,Prayers in The Emergency Room 01,http://www.gramedia.com,,,TAMAYO KOYASU,978-602-339-697-9,25000,4,R,Jepang,"11,4 x 17,2",240,"drama,slice of life,hospital","Shoen Matsumoto adalah seorang biksu sekaligus dokter unit gawat darurat.
Waktu kecil dia menyaksikan temannya mati tenggelam tanpa bisa melakukan apa-apa.
Sejak itulah dia bertekad belajar berenang, menyelamatkan jiwa melalui ajaran Buddha dan menyelamatkan nyawa manusia dengan menjadi dokter. 
Dia makan daging, juga minum sake. Dia juga datang terlambat, kadang-kadang emosian.
Inilah kisah dokter membingungkan yang berkeliaran dalam rumah sakit memakai jubah biksu!
",,3047_Prayers_in_The_Emergency_Room_01.jpg,,,,,
3048,1,23/03/2016,House of The Sun 11,http://www.gramedia.com,,,TAAMO,978-602-339-771-6,20000,4,R,Jepang,"11,2 x 17,6",192,"drama,romance,shoujo","Sebenarnya aku paham yang terpenting adalah bisa berada bersama. 
Kata-kata itu masalah nomor dua. 
Ini bukan akhir. Ini awal. Permohonan kita pasti terkabul.

Keluarga Nakamura dan keluarga Motomiya pergi liburan bersama. Mao berjuang untuk mendekatkan jarak dengan ayahnya, sedangkan Hiro berusaha mendekati adiknya, Hina. 
Tapi ternyata Hina memiliki perasaan terpendam mengenai kematian orang tuanya. 
Sementara itu, Mao akhirnya mendapat sepatah kata yang dinanti-nantikannya dari sang ayah!

Apakah akan tiba waktunya permohonon Mao dan Hiro terkabul?",,3048_House_of_The_Sun_11.jpg,,,,,
3049,1,23/03/2016,The Designer Revenge 04 tamat,http://www.gramedia.com,,,MIYUKI YORITA,978-602-339-783-9,20000,4,R,Jepang,"11,2 x 17,6",160,"drama,intrigue,revenge,fashion","‘Kalau sudah terbiasa melakukan kejahatan, maka rasa bersalah itu tidak akan ada lagi.’

KALEN yang membuat perangkap demi mendapatkan kemampuan desain Yotsuba. 
Ran yang mengatakan bahwa Shu adalah ayah dari anak dalam perutnya demi merebut Shu dari Yotsuba. 
Di tengah semuanya itu, ada Wedding Dress Contest yang menjadi pertarungan terakhir, yang menentukan di antara pada wanita tersebut. Bagaimana Yotsuba yang sudah kehilangan semuanya akan berjuang di tengah-tengah kebencian dan kebohongan?! Drama menegangkan yang tak dapat diduga akhirnya ini akhirnya akan sampai pada sebuah akhir!",,3049_The_Designer_Revenge_04_tamat.jpg,,,,,
3050,1,23/03/2016,"Night is Short, Walk On Girl 05 tamat",http://www.gramedia.com,,,RANMARU KOTONE / TOMIHIKO MORIMI,978-602-339-819-5,20000,4,R,Jepang,"11,2 x 17,6",184,"drama,fantasy,romance","Kyoto dicekam musim dingin menggigit dan wabah flu melanda seisi kota. Hanya “si gadis” yang tak terkena flu, dan dia harus berjalan mencari sebabnya... Inilah jilid terakhir kisah cinta komikal di Kyoto!",,"3050_Night_is_Short,_Walk_On_Girl_05_tamat.jpg",,,,,
3051,1,23/03/2016,Shi Heilong II vol. 8,http://www.gramedia.com,,,TONY WONG,978-602-339-809-6,70000,5,R,Hongkong,17 x 24.5,96,"drama,action,battle","Aliran Teratai Putih sedang menghadapi banyak masalah, kalangan atas dan bawah tidak bersatu. 
Masalah demi masalah muncul. Salah satunya Wang Fenglei telah membunuh presiden, dan kini menjadi buronan. Bagaimana Wang Buhu bisa meneruskan kewajibannya?",,3051_Shi_Heilong_II_vol._8.jpg,,,,,
3052,1,30/03/2016,Cute Glasses Boys 02,http://www.gramedia.com,,,SHIN KAWAMARU,978-602-339-852-2,20000,5,R,Jepang,"11,2 x 17,6",192,"drama,romance,shoujo,school life","Cowok super keren yang bersembunyi di balik kacamatanya.
Cowok lugu berkacamata yang membuat deg-degan.
Cowok berkacamata yang misterius tapi memesona.

Cowok-cowok keren berkacamata impianmu, pasti ada di sini!",,3052_Cute_Glasses_Boys_02.jpg,,,,,
